_id,question_title,question_content,question_datetime,answer1_content,answer1_datetime,answer2_content,answer2_datetime,answer3_content,answer3_datetime
65dd8f4f5bf02f695c36f253,대장암증상 극복에 좋은 것,"대장암증상 진단을 받고 치료를 받았는데요.\n앞으로 꾸준히 관리를 함에 있어\n도움되는 게 있는지 찾아보다가\n타히보가 대장암증상 극복에 좋다는 걸 알았어요.\n하지만 타히보는 고온이 아니라 \n저온 추출한 추출물을 먹으라고 하던데, \n이게 맞는 건가요?",작성일\n2024.01.15,"안녕하세요, 닥톡-네이버 지식iN 상담영양사 주소영입니다.\n대장암증상에 대해 질문주셔서 답변드리겠습니다. \n대장암증상 치료 받으실 때 \n타히보가 좋다는 것은 많은 분들이 아시고 계실 겁니다.\n타히보 추출물에는강력한 항암 효능을 비롯해\n면역력 증강, 항균, 항염, 진통,항산화, 상처 회복 등 \n대장암증상 환자분들에게 직간접적으로 도움을 줄 수 있는\n효능들이 있다는 것이 수천 건의 연구 논문과 \n특허 정보 자료를 통해서 입증되어 있습니다.\n그리고 대장암증상 치료 시 타히보를 섭취할 때에는\n질문자께서 언급해 주셨듯이 ""저온 추출""이 가장 중요합니다.\n왜냐하면 대장암증상 치료에 좋은 타히보 속 대부분의 유효성분들은 \n휘발성을 띠고 있기 때문에 고온으로 끓여서 추출하게 되면\n그 과정에서 유효성분들이 소실되기 때문입니다.\n따라서 타히보 저온추출물인지 꼭 확인하실 필요가 있습니다.\n이를 포함하여 대장암증상 치료에 도움되는 타히보 제품 선택 시\n알아두셔야 하는 사항을 아는지식내로 말씀드리겠습니다.\n1. 타히보 저온 추출물 제품\n2. 브라질산 정품 원료 100% 제품\n3. 타히보 추출물 100% 제품\n4. 다년간 판매되어 신뢰할 수 있는 제품\n이와 같은 선정 조건에 맞는 제품을 선택하셔서\n아무쪼록 대장암증상 치료에 큰 도움을 받으시기를 바라겠습니다.\n도움되셨길 바랍니다 그리고 완치되시길 바랍니다. ",2024.01.15.,,,,
65dd8f505bf02f695c36f255,뇌졸중 전조증상,저희 어머니가 한쪽 시야가 가려지고 번쩍거리는 섬광현상이 일어난다고 하더니 갑작스러운 심한 두통으로 누워서 앓아야할만큼 아파하는 증상이 반복적으로 일어납니다.\n두통부위는 정수리+정수리 옆 한쪽의 편두통 중심인 것 같고 시야이상과 심한 두통 등 뇌졸중 전조증상이 몇번씩이나 반복적으로 일어났다가 사라지고 있습니다.\n어머니가 뇌동맥류가 있으신데 병원에서는 몇년째 부풀지 않오 그대로여서 괜찮다고 했다고 합니다.\n1. 뇌동맥류증상으로 저런 증상들이 나타날 수 있을까요?\n2. 뇌졸중 전조증상으로 보이는 증상이 벌써 10번이상 일어났는데 뇌졸중도 아니고 계속 나타나는 이유가 뭘까요?\n3. 이런 증상이 나타날때 대처법은 뭘까요?,작성일\n2024.01.21,"안녕하세요. 하이닥-네이버 지식iN 상담의 김영준 입니다.\n문의해 주셔서 감사합니다. 질문자님께서 뇌질환을 의심하고 계신 듯한데요.\n질문자님께서 작성하신 증상만으로 어떤 종류의 뇌질환인지 곧바로 진단할 수 있으면 좋겠습니다만, 뇌질환을 확정하는 특정한 증상이 따로 있는 것이 아니기 때문에 의심되는 증상이 발생하였다면 꼭 뇌질환이 아니더라도 병원에 가 보시는 것이 좋겠습니다. \n뇌질환을 진단하기위해서 기본적으로 뇌에 대한 영상 검사가 필수적이기때문에 CT 나 MRI 가 가능한 병원에 신경과나 신경외과를 방문해서 진료를 받으시기 바랍니다. CT는 보험적용이 가능하고 MRI도 2018년 10월부터 전문의 소견에 따라 보험적용을 받습니다만 간혹 뇌질환의 진단이 되지 않으면 보험이 되지 않을 수도 있어 고가의 검사가 됨을 참고로 진행하시면 되겠습니다. 답변이 도움이 되었기를 바랍니다. 감사합니다.",2024.01.22.,,,,
65dd8f515bf02f695c36f257,전립선암 증상 인지요?,"전립선암 증상에 퀵큐민 드시는 분들이 대부분이던데, 이게 왜 좋은건가요?\n소변 볼때마다 시원치 않은게 전립선암 증상이라더군요..\n진짜 검사결과로도 전립선암 판정 받았습니다\n\n다행히 아직 전립선암 1기라서 관리만 잘하면 생존율이 100%라고 하더군요\n그래서 항암에 좋은 거 찾아보고 있는데 커큐민이 항암 효과가 좋다네요? 이게 어떻게 좋은 건가요?\n\n커큐민 중에서도 대부분 퀵큐민을 드시던데 이게 무엇인지 궁금합니다\n일반 커큐민과 어떤 식으로 다른건가요?\n\n전립선암 증상 및 관리에 어떻게 좋은건지 구체적으로 알려주세요",작성일\n2023.12.03,"안녕하세요, 닥톡-네이버 지식iN 상담약사 정상원입니다.\n전립선암 증상이 있는 것 같아 퀵큐민을 드셔보려 하시는군요\n전립선암은 우리나라의 남성 암 순위로는 4위에 들 정도로 발병률이 높은 암 질환입니다.\n주로 질문자님 나이대인 중,장년층 남성에게 많이 발생하지만 젊은 연령대에도 발생하는 경우도 적지 않은데요.\n서구화 된 식습관으로 인해 점점 더 발생률이 늘어나고 있지만 검진 덕분에 조기 발견 및 치료로 사망률은 적은 암에 속합니다.\n전립선암 증상으로는 주로 비뇨기쪽 불편이 많이 나타납니다. 소변을 볼 때 불편감, 혈뇨, 혈정액을 보이게 되며 골반이나 허리가 아픈 증상도 동반됩니다. 만약 요관이 막혔다면 수신증이나 신부전 등 추가 검사들도 요할 수 있습니다.\n전립선암 증상을 예방하기 위해서는 식습관이 중요한데요. 항암에 도움을 주는 음식에는 강황이 대표적입니다. 엄밀히 말하면 강황 속 커큐민이지요. 실제로 강황이 주재료인 카레를 먹는 인도인들은 암 발병률이 세계에서 가장 낮은데, 핵심 요인은 커큐민의 항암효과 때문입니다.\nBIOFACTORS 라는 과학수준 학술지에서 커큐민과 관련한 연구를 발표했는데요. 커큐민이 여러암에서 면역세포를 활성화시켜 대표적인 염증에 영향을 미쳤다고 합니다. 5천 년이 넘는 연구자료들이 있는 커큐민은 흡수율이 낮다는 단점이 있어 차나 식품으로는 커큐민의 항암효과를 경험하기에 한계가 있습니다.\n그래서 커큐민의 흡수율을 높이기 위해 물에 잘 녹는 형태로 만들게 되었는데요. 그것이 퀵큐민입니다. 퀵큐민은 미셀화 공법이 적용되어 물에 잘 녹는 형태로 고안되었고, 이에 따라 기존의 형태보다 체내 흡수율을 455배나 높아진 커큐민입니다. 여기에 피페린까지 더하여 흡수율이 2000%나 더 높여 더 업그레이드 되었습니다.\n2, 3년 전부터는 미국, 영국 등을 포함한 선진국에서 퀵큐민과 오메가3 배합을 선호하고 있는데요. 두 원료가 만나면 긍정적인 상호보완효과가 나타나 현재까지도 세계적으로 주목하는 조합으로 자리잡았습니다.\n현재 전립선암 증상으로 항암 효과가 필요하신 질문자님께서도 퀵큐민에 오메가3가 함께 배합된 구성 및 제품으로 챙겨드시는 게 좋을 것 같네요.\n이상 전립선암 증상에 관한 답변을 마무리하겠습니다.\n감사합니다.\n455배 커큐민, 퀵큐민이라 칭하기도 하는데요 여기에 오메가3을 더하여 한층 더 좋아진 구성이 있습니다\n많은 나라들에서 연구대상인 커큐민인만큼, 이러한 구성은 미국과 영국 등에서도 선호하기도 하는데 이런 제품이 있다는 것도 아시면 좋을 것 같습니다\n하지만 의약품은 아니기 때문에 반드시 모두에게 다 같은 효과를 적용하기란 어렵습니다\n사람의 몸은 다 다르고, 변할 수도 있기 때문에 새로운 식품을 드시기 전에는 질문자님의 몸 상태가 고려되어야 합니다\n전립선암 증상 관련하여 답변이 도움 되셨길 바랍니다\n감사합니다.",2023.12.03.,,,,
65dd8f525bf02f695c36f259,전립선암 증상 인지요?,"전립선암 증상에 퀵큐민 드시는 분들이 대부분이던데, 이게 왜 좋은건가요?\n소변 볼때마다 시원치 않은게 전립선암 증상이라더군요..\n진짜 검사결과로도 전립선암 판정 받았습니다\n\n다행히 아직 전립선암 1기라서 관리만 잘하면 생존율이 100%라고 하더군요\n그래서 항암에 좋은 거 찾아보고 있는데 커큐민이 항암 효과가 좋다네요? 이게 어떻게 좋은 건가요?\n\n커큐민 중에서도 대부분 퀵큐민을 드시던데 이게 무엇인지 궁금합니다\n일반 커큐민과 어떤 식으로 다른건가요?\n\n전립선암 증상 및 관리에 어떻게 좋은건지 구체적으로 알려주세요",작성일\n2023.12.03,"안녕하세요, 닥톡-네이버 지식iN 상담약사 정상원입니다.\n전립선암 증상이 있는 것 같아 퀵큐민을 드셔보려 하시는군요\n전립선암은 우리나라의 남성 암 순위로는 4위에 들 정도로 발병률이 높은 암 질환입니다.\n주로 질문자님 나이대인 중,장년층 남성에게 많이 발생하지만 젊은 연령대에도 발생하는 경우도 적지 않은데요.\n서구화 된 식습관으로 인해 점점 더 발생률이 늘어나고 있지만 검진 덕분에 조기 발견 및 치료로 사망률은 적은 암에 속합니다.\n전립선암 증상으로는 주로 비뇨기쪽 불편이 많이 나타납니다. 소변을 볼 때 불편감, 혈뇨, 혈정액을 보이게 되며 골반이나 허리가 아픈 증상도 동반됩니다. 만약 요관이 막혔다면 수신증이나 신부전 등 추가 검사들도 요할 수 있습니다.\n전립선암 증상을 예방하기 위해서는 식습관이 중요한데요. 항암에 도움을 주는 음식에는 강황이 대표적입니다. 엄밀히 말하면 강황 속 커큐민이지요. 실제로 강황이 주재료인 카레를 먹는 인도인들은 암 발병률이 세계에서 가장 낮은데, 핵심 요인은 커큐민의 항암효과 때문입니다.\nBIOFACTORS 라는 과학수준 학술지에서 커큐민과 관련한 연구를 발표했는데요. 커큐민이 여러암에서 면역세포를 활성화시켜 대표적인 염증에 영향을 미쳤다고 합니다. 5천 년이 넘는 연구자료들이 있는 커큐민은 흡수율이 낮다는 단점이 있어 차나 식품으로는 커큐민의 항암효과를 경험하기에 한계가 있습니다.\n그래서 커큐민의 흡수율을 높이기 위해 물에 잘 녹는 형태로 만들게 되었는데요. 그것이 퀵큐민입니다. 퀵큐민은 미셀화 공법이 적용되어 물에 잘 녹는 형태로 고안되었고, 이에 따라 기존의 형태보다 체내 흡수율을 455배나 높아진 커큐민입니다. 여기에 피페린까지 더하여 흡수율이 2000%나 더 높여 더 업그레이드 되었습니다.\n2, 3년 전부터는 미국, 영국 등을 포함한 선진국에서 퀵큐민과 오메가3 배합을 선호하고 있는데요. 두 원료가 만나면 긍정적인 상호보완효과가 나타나 현재까지도 세계적으로 주목하는 조합으로 자리잡았습니다.\n현재 전립선암 증상으로 항암 효과가 필요하신 질문자님께서도 퀵큐민에 오메가3가 함께 배합된 구성 및 제품으로 챙겨드시는 게 좋을 것 같네요.\n이상 전립선암 증상에 관한 답변을 마무리하겠습니다.\n감사합니다.\n455배 커큐민, 퀵큐민이라 칭하기도 하는데요 여기에 오메가3을 더하여 한층 더 좋아진 구성이 있습니다\n많은 나라들에서 연구대상인 커큐민인만큼, 이러한 구성은 미국과 영국 등에서도 선호하기도 하는데 이런 제품이 있다는 것도 아시면 좋을 것 같습니다\n하지만 의약품은 아니기 때문에 반드시 모두에게 다 같은 효과를 적용하기란 어렵습니다\n사람의 몸은 다 다르고, 변할 수도 있기 때문에 새로운 식품을 드시기 전에는 질문자님의 몸 상태가 고려되어야 합니다\n전립선암 증상 관련하여 답변이 도움 되셨길 바랍니다\n감사합니다.",2023.12.03.,,,,
65dd8f535bf02f695c36f25b,불안장애 라고 하는데 증상??,안녕하세요\n40대 중반 불안장애에 라고 하는데\n불안장애는 곧죽을거같은 질식 갑작스러운\n발작이 일어날까봐 두려워하는거라고 하는데\n저의 증상은 한시간동안 수시로 약하게 호흡곤란이 오고\n심장이 빨리뛰고 계속이런패턴이 8차례이상 반복되고요\n이런 증상때문에 정신과가서 약을처방받았는데\n약 한번 먹으니 증상이 바로사라졌습니다\n다시발작이 일어날까봐 불안해한다고하는데\n전 불안하지도 않고 일상생활하는데\n이것이 공항장애인가요?,작성일\n2024.01.27,"안녕하세요. 하이닥-네이버 지식iN 상담의 전우현 입니다.\n위 증상은 말 그대로 불안장애 증상입니다. \n공황장애는 불안장애의 한 종류(아형)이며 다른 질환이 아닙니다. \n아래 관련 정보를 정리하여 첨부하오니 읽어보시고 참고하시길 바랍니다. \n# 불안장애(Anxiety Disorder)\n불안장애는 여러 형태의 비정상적이고, 병적인 불안과 공포로 말미암아 일상 생활에 장애를 일으키는 정신 질환을 말하며 여기에는 여러가지 특정 불안 장애들로 분류가 됩니다. 불안과 공포는 위험으로부터 본인을 보호하는 일종의 정상적인 정서 반응이지만, 정상적 범위를 넘어서면 필요 이상의 불필요한 불안과 공포로 인하여 정신적 고통과 신체적 증상을 초래할 수 있습니다. 불안은 교감신경을 흥분시켜 두통, 심박동수 증가, 호흡수 증가, 위장관계 이상 증상과 같은 신체적 증상을 유발시켜 불편하고 가정과 직장 생활, 학생의 경우 학업과 같은 일상 활동을 수행하기 어려운 경우 불안장애로 진단할 수 있습니다. 이러한 불안장애에는 다양한 진단이 있으며, 각각 진단기준이 상이합니다. 불안장애에 속하는 대표 질환으로는 공황 장애(광장공포증을 동반하거나 하지 않는), 특정 공포증(고소 공포증, 특정 동물(예를 들어 뱀) 공포증 등), 사회 공포증, 강박 장애, 외상 후 스트레스 장애, 범불안장애, 급성 스트레스 장애를 포함합니다. \n■ 주요 증상\n불안장애에 흔한 증상은 아래와 같습니다. \n- 불면증(잠을 잘 자지 못하고, 자는 중간에 자주 깨거나 잠이 들기도 힘듦)\n- 예민하고 잘 놀람(그럴 때마다 심장이 심하게 두근거리고 불편함)\n- 사소한 일에도 지나치게 염려함(걱정이 꼬리에 꼬리를 무는 형태의 고민에 빠짐)\n- 집중을 할 수 없음(수분 이상 한가지 일에 집중이 힘들고, 했던 일이 기억이 잘 안남)\n- 마음이 항상 불안한 생각으로 차 있음\n- 초조함\n- 쉽게 피로하고 만성적인 피로감이 있음\n- 절망적이고 해결책이 떠오르지 않아 불안함\n- 근육의 경직과 긴장\n- 호흡이 빠름, 가슴이 두근거리고 심장박동이 빨라짐\n- 얼굴이나 가슴이 화끈거림\n- 이마 찌푸림(자신도 모르게 얼굴을 찌푸림)\n- 손발이 저림\n- 입이 마름\n- 목에 무엇인가 걸린 듯한 이물감이 느껴짐\n- 소변을 자주 봄\n- 아랫배가 불편하고 설사함\n- 시력이 감퇴하고 불편함(안과적 문제가 없음에도)\n- 소화가 잘 안되고 늘 속이 더부룩하며, 식사 후 답답함\n- 관절이나 온몸이 돌아가면서 아픔\n■ 불안장애의 아형은 아래와 같습니다. \n1) 공황 장애\n공황 발작 시 호흡곤란, 가슴 답답함, 심장 박동 증가, 발한, 기절, 죽을 것 같은 생각 등과 같은 증상이 있을 수 있으며, 발작이 없을 때는 발작이 재발할 것에 대해 과도하게 걱정하고, 공황 발작과 관련되어 있다고 생각하는 장소(사람 많은 곳, 좁은 장소, 터널 등)나 교통수단(지하철, 비행기 등)을 회피하는 것이 주요 증상입니다.\n2) 강박 장애\n자신의 손이 오염되었다는 생각, 집에 문을 잘 잠그고 왔는지에 대한 걱정, 주변 물건의 배치를 대칭적으로 해야겠다는 생각 등이 자꾸 머리 속에 떠올라 이를 행동으로 옮기지 않으면 불안감이 증가합니다. 이러한 불안을 덜기 위해 손을 20~30분씩 자주 씻어 습진이 생기거나, 칫솔질을 오래 해 잇몸이 손상되거나, 문이 잘 잠겼는지 자꾸 확인하여 외출하는 데 시간이 오래 걸리기도 합니다.\n3) 외상 후 스트레스 장애\n정신적 충격을 주는 사고나 재해 이후에 꿈이나 회상을 통해 사고나 재해를 반복적으로 재경험하게 되거나, 이와 관련된 장소나 교통 수단을 회피하고, 각성, 흥분 상태가 지속되어 불면, 감정 통제의 어려움 등을 느끼게 됩니다.\n4) 범불안장애\n과도한 불안과 걱정이 장기간 지속되며, 이를 통제하기 어렵고 불안과 연관된 다양한 신체 증상(불면, 근긴장도 증가 등)이 나타납니다.\n5) 특정 공포증\n특정 조건에서 불안이 과도하게 상승하여 행동에 대한 통제가 되지 않는 것으로, 높은 곳, 뱀, 곤충, 혈액, 주사기 바늘 등을 접했을 때 울면서 주저앉거나 의식을 잃는 등의 행동이 나타날 수 있습니다.\n6) 사회 공포증\n특징적 증상은 다른 사람들 앞에서 말하거나 행동하는 것을 매우 힘들어 합니다. 대인 만남을 기피하게 되고, 이로 인하여 사회생활이 어렵습니다.\n■ 원인\n불안장애에는 각기 다른 성격의 여러 정신질환(공황 장애, 강박 장애, 외상 후 스트레스 장애, 특정 공포증 등)이 속해 있어, 복합적이라 원인을 한마디로 규정하기는 어렵습니다만 통상적으로 불안이나 우울 등의 정서적인 부분을 담당하는 뇌신경 내의 신경전달물질의 부족 또는 과다, 유전적으로 타고난 성격이나 여러가지 일부 유전자적 문제, 뇌영상 연구에서 밝혀진 뇌의 기능적 또는 구조적 변화와, 사회심리학적인 측면, 과거의 경험과 현재의 받아들인 정보를 해석하고 판단하는 인지행동적인 부분까지도 병적인 불안을 일으키는 원인이 될 수 있습니다. 특히 외상 후 스트레스 장애나 급성 스트레스 장애는 극심한 정신적 충격을 일으키는 사고나 재해 등이 원인으로 주로 발병합니다.\n■ 치료\n불안장애의 세부 진단에 따라 그 치료법이 달라질 수 있으나, \n대체적으로 항우울제와 항불안제를 이용한 약물 치료가 주요 치료제로 사용됩니다.\n항불안제는 즉각적으로 불안 증상을 경감하기 위해 사용되며, 항우울제는 그 효과가 나타나는데 보통 10일~2주 이상의 시간이 걸린다. \n불안장애 중 공황 장애, 강박 장애, 특정 공포증, 사회 공포증 등에서는 인지행동 치료법이 비약물 치료법으로 이용될 수 있습니다. 인지적 측면에서 나타나는 오류를 교정하고, 불안을 일으키는 요인에 환자를 노출한 후, 환자가 가지는 불안 증상과 행동을 조절하는 행동 치료를 통합하여 치료를 합니다. 이러한 통합 기법을 불안장애 종류에 따라 8회에서 16회까지 다양한 기간 동안 시행합니다. \n■ 예후\n불안은 정상적인 심리 반응이기 때문에 불안을 완전히 없애는 것은 쉽지 않습니다. 다만 치료에 의해 불안 정도를 일상생활에 최대한 방해하지 않는 수준으로 경감시켜 정상적으로 회복할 수 있으나, 재발이 잘 되며 경과가 만성화되는 경향이 있습니다. 불안장애는 흔히 우울장애를 동반하는 경우가 많고, 불안으로 인한 술을 자주 마시게 되면 알코올 의존이나 수면제과다 복용 등에 의한 약물 중독이 동반되는 경우가 있어 이를 주의할 필요가 있습니다.",2024.01.31.,,,,
