_id,question_title,question_content,question_datetime,answer1_content,answer1_datetime,answer2_content,answer2_datetime,answer3_content,answer3_datetime
65dd8fc55bf02f695c36f343,역류성식도염 증상 봐주세요,위염 역류성식도염으로 일년간 약을 먹고 있는데도 완치가 되질 않네요\n최근들어 전에 없던 이상한 증상이 생겼는데 이건 무슨 증상일까요\n식도가 뭔가 차있는 느낌과 목까지 차오르는 답답한 느낌이 하루정도 느껴지다가 담날 목구멍 가슴 귀 머리까지 화한 느낌이랄까 꼭 치약 발라놓은 느낌이 드는데요\n증상이 심해진 뭔가 더 나빠진 증상일까요?\n이런 증상도 역류성식도염 증상인가요? 궁금합니다,작성일\n2023.03.18,"안녕하세요.\n역류성 식도염의 가능성이 있어 보입니다.\n역류성 식도염의 증상은 정말 다양합니다.\n속쓰림이 주된 증상이며, 매주 한번 이상, 일상 생활에 지장이 있을 정도의 속 쓰림이 있다면\n역류성 식도염을 의심해 볼 수 있습니다.\n이외에도 눕거나 구부릴 때 생기는 속쓰림, 쉰 목소리와 목의 이물감, 흉부의 작열감 및 이물감,\n인후부 불쾌감, 쉰 목소리, 입마름, 연하곤란, 치아 부식까지 다양한 증상을 일으킬 수 있습니다.\n또한 역류된 위 내용물이 하부식도의 기침 수용체를 자극함에 따라 발생하여 기침이나 가래가 동반될 수 있습니다.\n역류성 식도염은 초기 대처가 매우 중요합니다. 증상이 조금 호전되었다고 임의로 약을 중단하거나 밑빠진 독에 물을 붙는 것처럼 약에만 의지하고 생활습관 식습관을 조절하지 않으면 바로 재발하는 골치 아픈 병입니다.\n특히 식습관이 중요합니다.\n이를 위해 위와 식도 사이 괄약근을 느슨하게 하는 지나친 음주나 삼겹살 등의 기름진 음식 섭취를 주의해야 하며 위산 분비를 촉진하는 탄산음료, 과일주스, 커피, 맵고 자극적인 음식 섭취를 줄여보시기를 조언드립니다. 또한 규칙적인 식사시간과 야식을 피하고 식후 가벼운 산책이나 걷기운동은 큰 도움이 된다고 합니다. 특히 취침 3시간 전에는 음식을 피하시는 것이 좋습니다.\n혹시 체질량지수가 과체중이거나 비만이라면 적절한 체중감량도 식도염에 큰 도움이 됩니다.\n식습관과 생활습관을 조절하시고 식도, 위 기능이 정상화 될때까지 2~4주 이상 꾸준히 약물 치료를 마치시는 것을 조언드립니다.",2023.03.18.,,,,
65dd8fc65bf02f695c36f345,목디스크증상 거북목인데,거북목인데 목디스크증상있을 가능성 높나요\n제가 며칠 전부터 목 주변이 너무 뻐근해서요\n평소 두통은 심했고 손저림은 아직 없습니다\n거북목은 고등학교때부터 그랬습니다\n목디스크증상 가능성 있을까요\n아님 더 다른 목디스크증상있으면 알려주세요\n감사합니다,작성일\n2023.07.12,"안녕하세요. 대한의사협회·네이버 지식iN 상담의사 김옥선 입니다.\n목디스크증상에 대해 질문주셨군요.\n현재 질문자님의 상태를 살펴 보지 못했기 \n때문에 정확한 설명을 드리기 어렵습니다. \n그러니 이에 대해서는 담당의와 상의를 \n해보는 것이 좋은데요. \n목디스크증상으로는 목 통증 외에도 경초\n신경이 눌리며 발생되는 많은 신경학적\n증상들이 있습니다.\n손이나 손가락이 저려오고 팔에 힘이\n빠지기도 하며 뇌쪽으로 혈액순환이 제대로\n되지 않아 두통, 현기증, 어지러움 등의\n증상들을 호소할 수 있어요.\n아무래도 거북목의 경우 머리 무게가\n그대로 어깨와 목으로 전달되며 목디스크의\n원인이 될 수 있기때문인데요.\n아직 손저림 증상이 없는 것은 손과 이어져\n있는 신경근을 건드리지 않았을뿐 디스크\n초기 증상을 의심해 볼 수 있으니 빠른 시일\n내에 검사를 받아보는 것이 좋겠습니다.\n쾌유를 빕니다.\n감사합니다.",2023.07.12.,,,,
65dd8fc75bf02f695c36f347,목디스크증상 발견한거면,"목디스크증상이 있으면\n손이나 팔저림도 있다고 하던데\n저는 아직까지 그 정도 단계는 아닌 것 같아요.\n하지만 뒷목이 좀 심하게 통증이 있고\n마사지나 찜질, 스트레칭 이런건 오히려\n하면 더 아프기도 한 것 같아서...\n목디스크증상인 것 같아서\n병원에 가보려고 합니다.\n저림이 있어야 많이 진행된 거라고 하던데\n저도 목디스크증상이 심한건가요?",작성일\n2023.07.26,"안녕하세요. 하이닥-네이버 지식iN 상담의 김상범 입니다.\n목디스크증상은 목과 어깨 사이인 승모근\n주위가 아프고 팔이 저리고 아픕니다.\n또한 고개를 한 쪽으로 돌리면 잘 돌아가지\n않고 팔이 아플 수 있습니다.\n간혹 견갑골인 날개뼈 주변이 아프기도 하며,\n고개를 뒤로 젖히는 것이 힘들어집니다.\n목디스크증상이 심한 경우에는 어깨와 팔이\n끊어질 것 처럼 아프기도 하기 때문에 이러한\n증상들을 보인다면 병원을 방문하는 것이 좋습니다.\n초기 목디스크증상에는 약물과 물리치료 등의\n보존적 치료로 호전을 기대해 볼 수 있습니다.\n하지만 조금 더 정밀하게 치료를 하면 주사나\n시술 등의 신경 치료가 필요할 수 있으며,\n이후에는 도수치료 및 운동치료로 관리를\n해주는 것이 좋습니다.\n감사합니다.",2023.07.26.,,,,
65dd8fc85bf02f695c36f349,이런 증상 무슨 병일까요?,이틀전부터 목 칼칼함 증상이 있었지만 열과 기침 증상은 없고 심장 두근거림이 어색할정도로 빠르게 또 잘 느껴지고 식욕 저하와 함께 속 메쓰꺼움과 헛구역질을 느끼고 있습니다\n그리고 가벼운 근육통과 피로도 동반됩니다\n이런 증상의 원인이 무엇일까요?,작성일\n2023.06.18,"안녕하세요.\n 역류성 식도염의 가능성이 있어 보입니다.\n 역류성 식도염의 증상은 정말 다양합니다.\n 속쓰림이 주된 증상이며, 매주 한번 이상, 일상 생활에 지장이 있을 정도의 속 쓰림이 있다면\n 역류성 식도염을 의심해 볼 수 있습니다.\n  이외에도 눕거나 구부릴 때 생기는 속쓰림, 쉰 목소리와 목의 이물감, 흉부의 작열감 및 이물감,\n 인후부 불쾌감, 쉰 목소리, 입마름, 연하곤란, 치아 부식까지 다양한 증상을 일으킬 수 있습니다.\n  또한 역류된 위 내용물이 하부식도의 기침 수용체를 자극함에 따라 발생하여 기침이나 가래가 동반될 수 있습니다.\n 역류성 식도염은 초기 대처가 매우 중요합니다. 증상이 조금 호전되었다고 임의로 약을 중단하거나 밑빠진 독에 물을 붙는 것처럼 약에만 의지하고 생활습관 식습관을 조절하지 않으면 바로 재발하는 골치 아픈 병입니다.\n 특히 식습관이 중요합니다.\n 이를 위해 위와 식도 사이 괄약근을 느슨하게 하는 지나친 음주나 삼겹살 등의 기름진 음식 섭취를 주의해야 하며 위산 분비를 촉진하는 탄산음료, 과일주스, 커피, 맵고 자극적인 음식 섭취를 줄여보시기를 조언드립니다. 또한 규칙적인 식사시간과 야식을 피하고 식후 가벼운 산책이나 걷기운동은 큰 도움이 된다고 합니다. 특히 취침 3시간 전에는 음식을 피하시는 것이 좋습니다.\n 혹시 체질량지수가 과체중이거나 비만이라면 적절한 체중감량도 식도염에 큰 도움이 됩니다.\n 식습관과 생활습관을 조절하시고 식도, 위 기능이 정상화 될때까지 2~4주 이상 꾸준히 약물 치료를 마치시는 것을 조언드립니다.",2023.06.18.,,,,
65dd8fc95bf02f695c36f34b,발가락 마비증상,60대 남성입니다\n\n한달 전부터 양쪽 발가락이 서서히 전체적으로 마비 증상을 보이고 있는데 \n\n어떤 증상으로 봐야 되는지 알고 싶어요,작성일\n2023.07.31,"안녕하세요. 하이닥-네이버 지식iN 상담의 김영준 입니다.\n문의해 주셔서 감사합니다. 질문자님께서 뇌졸중을 의심하고 계신 듯한데요.\n질문자님께서 작성하신 증상만으로 뇌졸중을 곧바로 진단할 수 있으면 좋겠습니다만, 뇌졸중을 확정하는 특정한 증상이 따로 있는 것이 아니기 때문에 의심되는 증상이 발생하였다면 꼭 뇌졸중이 아니더라도 병원에 가 보시는 것이 좋겠습니다. 뇌졸중을 진단하기위해서 기본적으로 뇌에 대한 영상 검사가 필수적이기때문에 CT 나 MRI 가 가능한 병원에 신경과나 신경외과를 방문해서 진료를 받으시기 바랍니다. CT는 보험적용이 가능하나 MRI 는 2018년 10월부터 보험적용이 일부 되기는 했지만 의사의 소견 상에서 반드시 MRI 검사가 필요하다고 판단되는 경우로 간혹 뇌졸중의 진단이 되지 않으면 보험이 되지 않아 고가의 검사가 됨을 참고로 진행하시면 되겠습니다. 답변이 도움이 되었기를 바랍니다. 감사합니다.",2023.07.31.,,,,
65dd8fca5bf02f695c36f34d,공황장애 증상 질문,"이게 공황장애증상일까요 부정맥증상일까요?\n\n심장이 불규칙적으로 뛰는 느낌이 아주 잠깐 한순간 들고 몇 초 뒤에 실신감이 들었습니다.\n불규칙적인 느낌은 10년쯤 전부터 시작됐고, 그 때는 한 달에 한 번 정도 나타나던 것이\n최근에는 한 달에 열 번 꼴로 나타납니다. \n실신감은 정말 가끔식 어쩌다 한 번 들구요.\n흔히 공황장애는 심장박동이 빨라지는 증상이 있다고 하는데, 저같은 경우 위 증상이 나타날 때 심박수를 측정해보니 75정도로 빠른 수치는 아닌 것으로 보입니다. 평소 심박수도 70정도이구요.\n\n작년에 동일 증상으로 심전도와 심초음파 검사 결과 큰 이상없다는 소견 받았고\n공황장애인 것 같다는 소견을 받았습니다.\n\n한동안 실신감 없이 지내다가 다시 증상이 나타나 좀 불안하네요.\n\n정신의학과를 가야할지 심장내과를 방문해야할지..",작성일\n2023.07.23,"안녕하세요\n 공황장애가 의심이됩니다\n 공황 장애는 갑자기 극도의 두려움과 불안을 느끼는 불안 장애의 일종이지요\n심한 불안과 초조감, 죽을 것 같은 공포를 느끼고, 이와 함께 가슴 뜀, 호흡 곤란, 흉통이나 가슴 답답함, 어지러움, 손발 저림, 열감 등의\n다양한 신체 증상을 경험하게 되는 질환입니다\n 원인으로는 생물학적(신체적인) 원인, 외부적인 스트레스, 개인적인 인생 경험(특히 유년기의 초기 경험)과\n이에 따른 인격의 발달이 함께 작용해서 발생하는 질환으로 설명하고 있습니다\n 방치하는 경우 증상이 더욱 심해지고 일상생활이 힘들어질수도 있기에 초기부터 적극적인 치료를 하는 것이\n좋다고 전문가들은 조언하고 있지요\n 공황 장애는 만성 질환으로\n자연적으로 회복되는 경우는 드물지요 하지만\n제대로 진단받고 적절히 치료받으면 70~90%의 환자는 상당히 호전되어 일상생활에 큰 영향을 받지 않는다고 합니다\n 가까운 정신건강의학과에 내원하셔서 적절한 약물치료와 인지행동 치료를 받으시는 것을 조언드립니다.",2023.07.23.,,,,
65dd8fcb5bf02f695c36f34f,목디스크증상 통증과 저림,목디스크증상이 좀 상세하게\n궁금하긴 한데 제가 지금 뒷목이\n많이 불편하고 뻐근하고 통증이 있긴 한데\n팔저림이나 그런건 잘 모르겠어요.\n제가 둔해서 목디스크증상을 잘 모르는건지\n아니면 목디스크증상 아니고 그냥 근육통이라서\n아픈건지 좀 모르겠어요...\n컴퓨터를 많이 하니까 목디스크증상 같긴 한데;;,작성일\n2023.07.21,"안녕하세요. 하이닥-네이버 지식iN 상담의 김상범 입니다.\n목디스크는 뒷목통증이 대표적이며 \n신경의 원활한 전달이 어려워짐으로 인해 \n두통, 어깨 및 팔저림 등의 증상도 동반될 수 있습니다.\n뒷목통증과 함께 위와 같은 증상이 동반되었다면\n목디스크의 가능성이 높다고 볼 수 있으며\n병원에 가셔서 정확한 진료 및 치료를\n받으시는 것이 좋겠습니다.\n목디스크의 경우 경미한 상황이라면 물리치료와 \n도수치료, 약물치료 등이 진행될 수 있으며\n그럼에도 통증호전이 어려운 경우라면 \n신경성형술 등의 시술도 고려될 수 있습니다.\n목디스크는 평소 생활습관에도 크게 영향을 받으므로\n고개를 너무 숙이고 있거나 경추에 무리를 주는\n습관, 베개 등을 피해주시기 바랍니다.\n감사합니다.",2023.07.21.,,,,
65dd8fcc5bf02f695c36f351,눈꺼풀처짐 증상이 있습니다 !,눈꺼풀처짐 증상이 있는데 어떻게 해야할지 고민입니다.\n\n현재 고3 수능을 준비중인 수험생입니다.\n제가 이렇게 질문을 드린사항에 대해서는 눈꺼풀처짐 증상때문에 너무 고민인데요\n눈꺼풀처짐 증상이 정확히 어떤 증상일까요?\n\n안검하수증상이 맞는지 모르겠습니다.\n검색해보면 안검하수 증상때문에 눈꺼풀처짐 증상이 나타난다고\n많이들 말하던데 그런 것 같기도합니다.\n\n특히 눈꺼풀처짐 증상이 있다보니 눈을 뜨기가 힘든건 부정할 수 없는 사실인 것 같아요.\n\n그리고 눈이 금방 피로해지고해서 공부에 집중하기도 힘들고 어려워서\n생각보다 성적에 많은 영향을 미치고 공부할때 집중하기도 힘듭니다.\n\n눈꺼풀처짐 증상 어떻게 해결을 해야할까요?..\n\n눈꺼풀처짐 증상에 대해서 어떻게 개선을 하는게 좋은지 아신다면\n답변 부탁드립니다.\n\n\n너무 고민입니다.,작성일\n2023.03.28,안녕하세요. 하이닥-네이버 지식iN 상담의 박장우 입니다.\n눈꺼풀처짐 증상으로 인해 많은 불편함을 겪고 계신 것 같습니다.\n일단 질문자님의 상태를 보아선 안검하수 증상으로 보입니다.\n이러한 안검하수 증상이 있을 경우 눈꺼풀처짐 증상이 나타나기 마련인데요\n너무 심할 경우엔 일상생활에 지장이 있는 건 물론 나중에 다른 문제로까지\n이어질 수 있기 때문에 눈꺼풀처짐 증상이 심하시다면 개선을 해보시는 것이 좋습니다.\n눈매교정과 같은 방법을 통해 눈꺼풀처짐 증상을 개선해 드릴 수 있는데요.\n일단은 상태가 어떤지 한번 살펴봐야 할 것 같습니다.\n일단은 질문자님의 경우 질문 내용에서 말씀드린 눈꺼풀처짐 증상을 보아선\n안검하수 증상으로 보이는데요 안검하수는 위 눈꺼풀에는 위 눈꺼풀을 위로 올렸다 \n아래로 내렸다 하는 근육이 연결되어 있습니다.\n이런 위 눈꺼풀의 올림근의 힘이 약해서\n위 눈꺼풀이 아래로 처지고 눈꺼풀 틈새가 작아지는\n상태로서 위 눈꺼풀이 내려와 있어 정상적으로\n눈을 뜨지 못하는 경우를 안검하수 증상이라 합니다.\n이러한 안검하수 증상이 보이신다면 눈매교정을 통해 안검하수를 개선해 볼 수 있습니다.\n일단은 병원으로 내원하셔서 자세한 진료를 통해\n눈매교정 여부에 대해서 결정해 보시는 것이 좋을 것 같습니다.\n감사합니다.,2023.03.29.,,,,
65dd8fcd5bf02f695c36f353,이 증상 천식 인가요..??,그냥 아무 생각 없을땐 괜찮은데 제가 숨을 쉬고 잇다는 걸 인식을 하게 되면 숨을 크게 쉬어야 하고 하품 한숨 이런 걸 하게돼요 그리고 폐?? 까지 숨이 잘 들어오는게 느껴져야 뭔가 편안해져요 그리고 이 증상이 숨을 쉬는 걸 인식을 못 할때 까지 지속되어요 몇년 전 부터 계속 이 증상이 나타나서 없애고 싶어요 이 글을 적으면서도 한숨 3번 쉬었습니다.. 이게 도대체 뭘 까요.. 제가 숨 쉬는 걸 인식을 함 으로써 생긴 일 일까요 복붙 하지 마시고 이 증상이 무슨 증상인지 어떻게 치료할 수 있는지 알려주세요,작성일\n2023.07.16,"안녕하세요\n인터엠디(InterMD) x 네이버 지식in 건강상담 의사 광주희망병원 내과 김무웅입니다.\nㅡㅡㅡㅡㅡㅡㅡㅡㅡㅡㅡㅡㅡㅡㅡㅡㅡㅡㅡㅡㅡㅡㅡㅡㅡㅡㅡㅡㅡㅡㅡㅡㅡㅡㅡㅡㅡ\n이야기 하신 증상은 천식의 저명한 증상은 아닙니다\n천식은 호흡곤란이 동반되고 쌕쌕거리는 소리가 나고 특히 밤이나 외부 찬공기 등의 자극이 있을 때 나타는 증상입니다\n한숨의 증상은 천식은 아니고. 제가 봤을때 그냥 특별한 질병은 아닌 것 같습니다 \n검사를 해보시겠다면 폐기능검사를 한 번 해보면 좋겠습니다. \np.s \n벌써 2023년도 절반이 지나갑니다. 더 궁금하신 점은 1:1 질문은 안되고 댓글 주시면 가능한 찾아서 답글 달아드리겠습니다.\n동남아 우기같은 장마와 더불어 더운 여름과 습한 날씨에 장염 환자가 많이 늘어나고 있습니다. 손씻기 등의 개인위생 잘 챙기시고 마스크를 벗은 뒤로 다시금 코로나/폐렴 환자가 늘어나고 있네요 ㅠ 건강관리 잘하시길 바랍니다.\n*오늘은 전국적으로 비가 너무 많이오니 차조심, 비조심, 사람 조심 하세요~",2023.07.16.,,,,
65dd8fcd5bf02f695c36f355,다래끼 증상 질문 드립니다.,제가 가끔 편두통이 있는데요.. 눈두덩이가 묵직하고 지끈 지끈거리고 급체 증상도 같이 왔었는데.. 또 똑같은 증상이 있어서 눈이 자꾸 아픈게 다른 질환이 있나 안과 가서 검사 한번 받아 봐야겠다하고 갔었는데 다래끼 증상이래요. 겉으론 나오지 않았는데 초기라고 하네요? 다래끼 날 때도 편두통과 같은 증상이 나타나는건가요? 여태 계속 편두통약 먹었었는데··,작성일\n2023.05.20,"안녕하세요. 하이닥-네이버 지식iN 상담의 구오섭 입니다.\n우리가 흔히 가끔씩 겪는 편두통을 일차성두통이라고 해서 특별한 원인이 없이 나타나게 되는데 보통은 잠을 못자서 수면부족을 느끼는 경우에도 두통이 올 수 있으며, 배를 탈때나 흔들리는 버스를 오래 탈 경우에도 멀리를 동반한 두통 등이 일시적으로 나타날 수 있는데요, 안구건조 증상이 심하다거나 눈에 다래끼나 결막염과 같은 염증 등이 있는 경우에도 두통을 동반할 수는 있습니다. \n우선 다래끼가 났을때는 안과에 가셔서 항생제와 소염제 등의 안약을 처방 받아 점안해 주시고 온찜질은 보조적인 방법으로 해주시면 되는데요, 너무 뜨겁지 않은 정도의 적당한 온도로 15분 정도 해주시는 것이 좋습니다. \n다래끼는 신체적으로 피곤하거나 면연력이 많이 떨어졌을 때 보통 많이 나타날 수 있는 질환으로 눈 분비샘에 기름이 쌓여 생기는 염증이 있고 눈에 세균 감염이 되어 농과 같은 염증이 생기는 등의 형태로 나타나게 됩니다.\n앞에 설명한 다래끼는 일명 콩다래끼라고도 불리우는데 분비샘의 기름이 잘 분비되어야 정상이나 주로 눈 밑 피부 안 쪽에서 막혀서 콩알 모양의 형태로 생기게 됩니다. 이와는 달리 세균 감염으로 생기는 다래끼는 화농성 염증이라고 하여 눈에 통증을 유발하거나 눈이 충혈되고 눈밑을 벗겨내면 빨갛게 부어 있는 상태를 볼 수 있습니다. \n보통 눈에 다래끼와 같은 증상이 생기게 되면 해당 부위에 통증이 생기면서 보통은 일주일이나 10일 정도 사이에 피부 밖으로 고름이나 비슷한 작은 돌기 등이 터지면서 점차 치유가 되는 경우가 있으나 반대로 점차 심해지거나 잘 낫지 않는 경우 또한 종종 나타나게 됩니다.\n눈의 기름샘의 출구가 막혀 기름샘이 고여있게 되는 경우 세균증식이 활발하게 되면서 다래끼와 같은 형태로 오랫동안 증상이 나타나는데 이때 항생제 등을 처방 받아도 잘 낫지 않는 이유가 해당 항생제 성분에 고여있는 다래끼 세균증식을 억제하는 역할을 해야 하는데 그렇지 못한 경우 항생제를 복용해 보시고 그래도 해당\n증상이 나아지지 않는다면 항생제가 세균증식을 억제할 수 없는 상황이므로 이런 경우에는 해당 부위를 쩨거나 하여 치료를 해주어야 합니다.\n따라서, 이런 경우 병원에 내원하셔서 증상에 대한 부분을 해결 할 수 있도록 해당 부위를 째거나 하여 치료하신 후에는 한 동안 꼭 항생제 등을 함께 복용하면서 치료 받아야 다시 재발이 되지 않기 때문에 참고하시기 바랍니다.\n감사합니다.",2023.05.21.,,,,
65dd8fcf5bf02f695c36f357,전립선염 증상 도와주세요,전립선염 증상으로 오래 치료했던 경험이 있어요.\n잠깐 좋아지다가 다시 전립선염 증상 반복되고 너무 힘드네요.\n한번 전립선염 증상 생기면 치료 어렵나요?\n만성으로 이어지는 거 같아서 걱정됩니다.\n전립선염 증상 치료 어떻게 하는게 좋을까요?,작성일\n2023.02.13,"안녕하세요. 하이닥-네이버 지식iN 상담의 류경호 입니다.\n전립선염 증상으로 질문하셨네요. 전립선염의 경우 50세 이하의 남성에게 흔하게 발생하는 비뇨기 질환 중 하나입니다. \n비교적 젊은 나이에 발생하기 쉬운 질환이기도 하며 전립선염은 말 그대로 전립선에 염증이 생기는 질환입니다. 전립선염 증상이 고민되신다면 병원에 내원하여 검사를 받아보시는 것이 좋겠습니다.\n전립선염은 연령, 임상증상, 발생 기간 등에 따라 급성과 만성으로 나뉘고 만성 전립선염은 전립선액, 전립선 마사지 후 소변검사, 정액검사를 통해 세균성과 비세균성으로 나뉩니다. 비세균성의 경우 발병 원인이 정확하지 않는 것이 특징입니다.\n전립선염은 크게 세균성과 비세균성으로 원인을 구분할 수 있으며 세균성 전립선염은 요도염의 원인균인 임질균(N gonorrhea), 클라미디아, 유리아플라스마, 마이코플라스마 제니탈리움 등이 전립선에 남아서 전립선염을 일으킬 수 있습니다. 이와는 다른 대장균(E coli), 클렙시엘라 등 원인균이 될 수 있습니다. \n이와 같은 균에 의한 원인이 밝혀지면 비교적 치료에 좋은 반응을 보입니다. 전립선염 증상은 통증, 배뇨 장애 및 성기능 문제를 동반합니다. 그러나 발생 원인이 다양한 만큼 전립선 증상도 다양해 다른 병으로 혼동하거나, 여러 질환이 복합적으로 발생했다고 보는 경우도 있습니다.\n따라서 전립선염을 치료할 때는 다각도 복합 원인검사를 통해 정확히 진단하는 것이 무엇보다 중요하겠습니다. 전립선염 증상이 있다면 진료 및 검사를 통해 임상 경험이 풍부한 의료진에게 치료를 받아야 치료 기간을 단축하고 재발의 위험을 줄일 수 있습니다.\n전립선염 증상 원인이 세균이 아닌 경우에는 염증의 발생 기전을 설명하기 어렵기 때문에 진단도 어렵습니다. 따라서 단순한 소변검사로는 확인이 불가능합니다. \n전립선염을 진단하기 위해 활용되는 검사는 무척 다양하지만, 모든 환자분에게 모든 검사를 진행하는 것 옳지 않습니다. 이때 우선순위와 중요도를 정해서 검사하고 진단하는 것이 중요하겠습니다. \n전립선염 증상, 원인에 따른 치료방법은 다양하기 때문에 전립선염 증상이 의심되면 정확한 진단은 병원에 내원하여 검사 후 전문의 소견에 따라 치료를 받으시는 게 좋겠습니다.\n답변이 도움이 되었으면 합니다. 감사합니다.",2023.02.13.,,,,
