_id,question_title,question_content,question_datetime,answer1_content,answer1_datetime,answer2_content,answer2_datetime,answer3_content,answer3_datetime
65dd8f895bf02f695c36f2c5,몸살증상과 비슷한 암종류,혹시 몸살증상과 증상이 비슷한 암이 있나요? 있으면 알려주세요 내공 20,작성일\n2024.02.16,몸살 증상과 증상이 비슷한 암은 간암 췌장암으로 흔히 나타납니다.\n또한 대부분의 암에서 몸살 증상과 증상이 비슷한 증세가 나타날 수도 있습니다.\n암 걸리는 이유 치료 방법 최고의 항암 음식 식단?\n항암 면역력 높이는 따뜻한 물의 중요성 따뜻한 물을 자주 하루 2리터 이상 마시는 것이 암 예방과 회복에 ...\nm.blog.naver.com,2024.02.16.,암이 초래하는 증상은 제각각입니다\n하지만 암성통증은 말기암일때 아니면 느끼는 경우가 잘 없고\n오히려 항암치료의 부작용으로 다양한 증상을 호소하게 됩니다\n몸살기운도 그중 하나입니다,2024.02.16.,,
65dd8f8a5bf02f695c36f2c7,협착증 증상 구부린 허리..,엄마가 요새 허리를 잘 못펴요.\n왜그러냐고 하니 허리가 아파서\n구부려야 그나마 살겠다고 합니다.\n아무리봐도 협착증 증상같은데\n엄마 말로는 간혹 그런다고\n신경쓰지 말라고 하는데 이게 신경을\n안 쓸 수가 있나요.\n엄마 나이도 있고 협착증 증상이\n맞는 거 같은데 진짜 답답합니다.\n협착증 증상을 발견했을 때 바로 치료\n받아야 결과도 더 좋은 거 아닌가요?,작성일\n2023.10.27,"안녕하세요. 대한의사협회·네이버 지식iN 상담의사 김옥선 입니다.\n협착증 증상에 대해 질문주셨군요.\n현재 질문자님의 상태를 살펴 보지 못했기 \n때문에 정확한 설명을 드리기 어렵습니다. \n그러니 이에 대해서는 담당의와 상의를 \n해보는 것이 좋은데요. \n허리를 구부리면 일시적으로 척추관의 공간이\n넓어지며 통증이 완화되기때문에 상체를 계속\n구부리는 동작이나 허리 통증, 보행장애 등의\n증상을 지속적으로 호소한다면 협착증 증상이라\n볼 수 있겠습니다.\n아무래도 협착증은 퇴행성 변화가 계속해서\n진행되면서 상태와 증상은 더 악화되는\n특징을 가지고 있기때문에 조속한 대응이\n중요할 수 밖에 없는데요.\n초기에 치료가 진행되어야만 비수술적 방법에\n효과가 탁월하고 상태가 더 악화되는 것을\n방지해 볼 수 있으니 가급적 빠른 시일 내에\n검사와 치료를 함께 받아보시기 바랍니다.\n쾌유를 빕니다.\n감사합니다.",2023.10.27.,,,,
65dd8f8a5bf02f695c36f2c9,한포진증상 궁금해요,손에 물집이 잡혀서 터트렸는데 며칠전에 또 다시 생기더니 또 사라졌어요. 한포진증상 같은데 한포진증상 좀 자세하게 알려주세요,작성일\n2023.06.21,"안녕하세요. 닥톡-네이버 지식iN 상담한의사 김태욱 원장입니다.\n한포진이란 손이나 발에 생기는 습진 증상으로 수포와 가려움증이 주 증상인데요.\n심한 경우 물, 각질, 갈라짐, 통증 등을 동반하기도 합니다.\n호전과 악화를 반복하면서 잘 낫지 않는 피부질환 중에 하나이기 때문에 사라졌다가도 또다시 생기는 것인데요.\n이러한 한포진은 주로 면역계 이상이나 화학물질, 물, 고무 등의 접촉에 의해 유발되는 것으로 알려져 있습니다.\n한방에서는 피부 면역에 문제가 생겨서 만성적으로 염증을 일으키는 상황이라고 보고 피부 면역에 생긴 문제를 해소할 필요가 있다고 봅니다.\n인스턴트 음식이나 자극적인 음식, 술, 유전자 변형 사료를 먹고 자란 가축으로부터 얻어진 육류, 양식 생선 등을 많이 먹게 되면 장에서 독소가 만들어지고, 그 독소는 혈액으로 유입되어 혈행을 타고 다니다 피부에 축적되어 피부 면역을 교란시키게 되고 각종 피부 증상을 만들어냅니다.\n따라서 한포진을 비롯한 습진성 질환들을 치료하기 위해서는 음식조절이 가장 중요합니다.\n위에서 언급된 장독소를 만들어 내는 음식의 섭취를 최소화시키고 과로, 스트레스를 피하도록 해야 합니다.\n한포진증상을 방치하면 손목과 발목으로까지 퍼지면서 손발톱의 변형을 유발할 수도 있으니 당장 수포가 사라졌다고 안심할 것이 아니라 정확한 진단과 그에 따른 치료 및 관리에 대해 조언 받아보시기 바랍니다.\n빠른 쾌유를 빕니다.",2023.06.21.,,,,
65dd8f8b5bf02f695c36f2cb,틱 증상인가요?,원래 안 그랬는데 최근에 가끔씩 머리가 틱증상처럼 흔들려요\n의식하니까 횟수가 더 늘어난 것 같은데\n아주 미세하게 덜컹 하는 느낌이라 다른 사람 눈에는 안 보이는 정도인것 같고 가끔씩 다리나 팔이나 등등도 아주가끔 흔들릴 때도 있어요\n이거 틱 증상일까요? 고칠 수 있을까요ㅠ,작성일\n2023.11.30,"안녕하세요. 하이닥-네이버 지식iN 상담의 전우현 입니다.\n질문하신 분의 성별, 나이, 기저질환 유무 및 복용 약물, 기타 의학적 기초 배경자료에 대한 설명이 없고 이렇게 서면으로 질문과 답변하는 것은 제한이 있을 수 밖에 없고, 이러한 정보는 어디까지나 참조용으로 사용할 뿐 의학적 판단 근거가 되기가 어려운 점을 미리 말씀드립니다. \n일단 말씀하신 이상 행동 증상이 정확하게 어떤 것인지 알 수는 없지만 비슷한 양상에 반복적으로 해당 이상 운동이 특정 상황에서 반복을 한다면 운동 틱의 가능성을 배제할 수는 없을 것 같습니다. 보통 통상적으로 틱 질환은 발병 연령이 말씀하신 것보다는 조금 더 어린 연령에서 발생합니다. 그리고 극소수를 제외하고 대부분 성인이 되면 저절로 사라지는 경우가 많습니다. 또한 약물에 대한 반응성도 좋은 편입니다. \n실제 임상에서 틱 장애로 진단하기 위해서는 감별 진단을 위해서 다른 신경과적 혹은 내과적 문제가 없는지 충분히 살펴보아야 하고 증상에 따라 감별 진단을 위해 뇌 자기 공명 영상 촬영, 혈액 검사, 뇌파 검사 등이 필요할 수 있습니다. 또한 정신과적인 우울장애인, 주의력 결핍 과잉행동장에, 반항성 도전장애 등 다른 정신과적 문제가 공존하는 경우도 하나이기 때문에이 부분에 대한 세심한 진단적 고려가 요구됩니다. \n틱장애 경과는 사람마다 매우 다양한데 대개 초등학교 정도에서 발생하는 경우가 흔하고, 특히 초등학교 고학년 사이에서 발생하는 경우가 가장 많습니다. 틱 증상은 보통은 한 가지에서 시작해서 다른 근육으로 옮기거나, 다른 틱이나 새로운 틱이 동반되는 경우도 많습니다. 수일 혹은 수개월에 걸쳐서 저절로 증상이 생겼다가, 없어지기도 하는 경우도 많고, 스트레스를 받거나 흥분하는 경우에 증상이 더 심해졌다가 며칠 있다 보면 갑자기 잠잠해지는 식으로의 양상도 흔히 관찰됩니다. 일시적인 틱은 대개 저절로 사라지고, 약 1% 정도에서만 만성 틱장애나 뚜렛 증후군등으로 발전하는 걸로 알려져 있습니다. \n만성 운동 틱 또는 만성 음성 틱장애에 진단 기준은 아래와 같습니다. 참고하시길 바랍니다. \n만성 운동 틱 또는 만성 음성 틱 장애의 진단 기준은 다음과 같다.\n1) 1가지 또는 여러 가지의 운동 틱 또는 음성 틱(갑작스럽고 빠르고 반복적, 비율동적이며, 같은 행동을 계속 반복하는(상동증) 동작 또는 음성)이 장애의 경과 중 일부 기간 동안 존재하지만, 두 장애가 함께 나타나지는 않는다.\n2) 틱은 1년 이상의 기간 동안 거의 매일 또는 간헐적으로 하루에 몇 차례 일어나고, 이 기간 동안에 틱이 없는 기간이 연속적으로 3개월 이상 지속되지는 않는다.\n3) 사회적, 직업적 또는 다른 중요한 기능 영역에서 심각한 고통이나 장해를 일으킨다.\n4) 18세 이전에 발병한다.\n5) 장해는 자극제 같은 물질이나 일반적인 의학적 상태(예: 헌팅턴 병, 바이러스성 뇌염)의 직접적인 생리적 효과로 인한 것이 아니다.\n6) 뚜렛 장애의 기준에 맞지 않아야 한다.\n원인은 사람마다 다양한데, 유전적인 요인도 있고, 뇌의 구조적 기질적 이상이 있거나, 뇌의 생화학적 이상이 있는 경우도 있고, 호르몬의 이상, 혹은 출산 과정에서의 뇌 손상이나 세균 감염과 관련된 면역 반응 이상 등이 틱 발생과 연관이 있는 것으로 조사되어 있습니다. 그 밖에도 학습 요인, 심리적인 요인 등이 틱 발생과 악화에 관련이 있습니다. 아주 가벼운 일시적인 팁은 주위에 관심이나 환경적 요인에 의해서 심해지거나 특정한 사회적 상황과 연관이 되어 나타날 수도 있습니다. 증상이 완전히 사라졌다가, 또 다시 특정 상황에서 재발하는 경우가 충분히 있다는 얘기입니다. 본인이나 주변 지인들이 틱에 대해서 지적을 하고 억제를 하려고 하면 더욱 심해지는 것도 사실입니다. \n그러니 일단은 너무 걱정하지 마시고, 마시고 대부분은 만성 틱 장애로 가지 않고 일시적으로 증상이 있다가 사라집니다. 너무 신경을 쓰면 오히려 해당 증상이 더 오래 지속되고 악화되는 경우도 있습니다. 만약 많이 신경이 쓰이고 불안하다면, 정신과 전문의를 방문하여 상담을 받아 보시는 것이 좋고, 필요한 경우에는 의사와 상의하여 환자의 합의하에 일시적으로 약물을 사용해 보는 것도 큰 도움이 됩니다. \n쾌차하시길 기원하겠습니다. ",2023.11.30.,,,,
65dd8f8c5bf02f695c36f2cd,특정 음식 섭취 후 설사증상,"안녕하세요 20대 중반 여자입니다.\n\n초등학생 때 장이 약해 장염이 자주 걸렸는데, 그 이후로는 별 탈 없이 살았습니다.\n\n20살 이후로 쭉 음주했구요 (현재는 1달에 1번 정도, 한 번 마시면 소주 2~3병) 흡연은 하지 않습니다.\n\n요즘 장 건강이 좋지 않은 것 같은데 이게 정말 건강에 이상이 있어서 그런건지, 현재 특수한 상황이라 그런건지 분간이 안가서 병원 가기 전 지식인에 먼저 질문드립니다.\n\n증상: 기름진 음식 섭취 후 차가운 물을 마시면 설사증상이 나타납니다.\n오늘(일요일) 낮에 생크림 크로플과 아이스 아메리카노 1잔을 마시고 (빨리 섭취하지는 않았습니다. 벤티 아아 한 잔을 2시간 정도 나눠서 마심.) 가벼운 설사 증상이 있었구요\n저녁에 돈사태수육과 무채, 쌈야채를 먹고나서 찬 물을 350ml 정도 마셨는데 바로 설사가 또 나왔습니다. 첫번째보다는 조금 심했으나 아주 심각한 정도는 아니었습니다.\n\n금요일 밤에 소주를 2병 반 정도 마셨었고, 지금 생리 5일차 입니다. 평소에도 숙취 증상으로 그 다음날 설사가 있고, 생리 초반에 설사 증상이 나타나지만 둘다 날짜가 애매해서 음주나 생리 때문에 그런건 아닐 것 같기도 합니다.\n\n지금 컨디션이 좋지 않아서 그런걸까요? 아니면 병원을 가보는 것이 좋을까요? 아님 원래 다 이러고 사는건가요?",작성일\n2023.09.03,"안녕하세요 \n과민성 대장증후군의 가능성이 높아 보이며 컨디션에 따라서 증상은 더 심해 질 수 있습니다. \n주요 증상은 배변 양상의 변화와 함께 발생하는 복통 혹은 복부 불편감입니다.\n배변 양상의 변화는 없을 수도 있습니다.\n  대장이 과민해져 대장의 운동이 지나치게 활발해져서 설사가 유발되거나\n 움직임이 급격히 감소한 경우 변비가 발생하면서, 설사와 변비가 반복되기도 합니다.\n  또한 내장 민감도가 증가하여 장 내 가스에 의해 복부통증이나 불편감을 쉽게 느낄 수 있고,\n 이외에도 복부팽만은 흔한 증상이며 속쓰림, 연하곤란 등의 상부위장관 증상과 전신 피로, 두통 등의 전신 증상도 나타납니다.\n  대변검사, 대장 내시경, 혈액검사 등을 통하여 다른 질환의 여부를 확인하여 특별한 이상이 없으면 과민성 대장 증후군의 가능성이 큽니다.\n  과민성 대장 증후군에 효과적인 단독 치료법은 없으며 증상에 따른 약물과 생활습관 변화를 통하여 치료해야 합니다.\n 규칙적인 식사와 적당한 휴식, 스트레스 관리, 과식을 피하고 식이섬유가 풍부한 음식 섭취, 저 FODMAP 식이, 유산균을 꾸준히 복용하는 등의 생활습관 변화가 꼭 동반돼야 합니다.\n ",2023.09.03.,,,,
65dd8f8d5bf02f695c36f2cf,당뇨 저혈당증상,당뇨진단을 받고 약없이 당화혈색소 9점대에서 5.7까지 내렸는데요. \n요즘 틈만나면 저혈당증상이 옵니다. 머리가 띵하고 힘이 없어서 퍼지고 가슴이 뛰는증상이 계속오는데 \n어떻게하나요? 저혈당증상막아주는약이 있나요?,작성일\n2023.09.29,"안녕하세요.\n인터엠디-네이버 지식iN 가정의학과 전문의 조성환입니다. \n당뇨진단을 받고 약없이 당화혈색소 9점대에서 5.7까지 내렸는데요. \n요즘 틈만나면 저혈당증상이 옵니다. 머리가 띵하고 힘이 없어서 퍼지고 가슴이 뛰는증상이 계속오는데 \n어떻게하나요? 저혈당증상막아주는약이 있나요?\n위와 같이 질문을 주셨는데, 저혈당 증상을 예방하는 약은 없습니다. 당뇨병이 처음 진단되어 약을 처방받으면서 열심히 운동과 식이요법을 하면 당화혈색소가 뚝 떨어지고 저혈당도 자주 나타나는 경우가 있습니다. \n아직 혈당이 안정화되지 않아 무리하게 혈당이 떨어지는 경우가 생기는 것 같습니다. 혈당이 떨어지면 갑자기 어지럽고 힘이 빠지고 가슴이 두근거리거나 손발이 떨리고 식은땀이 나는 등의 증상이 나타날 수 있습니다. 만약 식사가 늦거나 식사량이 너무 적거나 운동량이 많을 때 이런 증상이 나타난다면 저혈당 가능성이 있으므로 주변에 있는 음료수나 사탕, 초콜렛 등을 급히 섭취하는 것이 좋습니다. \n그리고 이런 일이 여러번 반복된다면 복용중인 당뇨병 약을 좀더 약하게 조정하거나 변경하여야 합니다. 약을 조정하면 저혈당증상은 훨씬 줄어들 수 있으나 반대로 혈당이 올라갈 수 있으니 꾸준히 정기적으로 검사하면서 관리할 필요가 있습니다. ",2023.09.29.,,,,
65dd8f8f5bf02f695c36f2d1,방광염 증상인거 같아요,방광염 증상 같아서 병원 가보려고하는데요.\n소변 볼때 화끈거리는 증상이 있어요.\n몇달전에 방광염으로 치료 했던적 있어요.\n방광염 재발한거 같은데 확실한 치료 방법 없나요?,작성일\n2023.06.02,"안녕하세요. 하이닥-네이버 지식iN 상담의 류경호 입니다.\n방광염 치료 때문에 질문하셨네요. 먼저 방광염 재발로 인해 많이 힘드신 상황 같습니다. 방광염 증상으로 배뇨장애를 보이거나 일상 생활을 하는데 불편함을 느끼시는 분들이 정말 많습니다. \n여자 방광염 증상은 재발이 잦은 질환이기도 하며, 다른 질환과 혼동될 수도 있으므로 정확한 원인균을 규명하여 치료받으시는 것이 중요하겠습니다. 아래는 여자 방광염 증상입니다.\n이 외에도 여자 방광염 증상은 다양하며 해부학적으로 여성에게 발생할 확률이 높습니다. 방광염 증상은 배뇨장애를 동반하며 피곤하거나 병으로 몸의 저항력이 떨어질 때 더 잘 발생하므로 평소 건강관리에 주의해야 방광염을 예방할 수 있습니다.\n방광염은 대부분의 염증이 그렇듯이 세균이 방광으로 침입하여 감염을 일으키거나, 방광에 자극이 가해지면 방광염이 발생합니다. 해부학적으로 여성은 남성보다 요도의 길이가 평균 14cm 정도 짧습니다.\n이럴 경우, 장내 세균이 회음부와 질 입구에 쉽게 증식할 수 있고 성생활이나 임신을 통해 세균이 방공으로 역행하여 상행성 감염을 일으키게 됩니다. 결국, 요도 길이의 차이 때문에 방광염이 여성에게 더 많이 발생하는 것입니다.\n여자 방광염 원인은 단순 방광염일 경우 주된 원인은 대장균이며, 그다음은 포도상구균입니다. 그 외에는 장내세균에 속하는 여러 원인균에 의해 나타나며 성관계에 의한 방광염이 발생하기도 합니다. \n이러한 경우 클라미디아 같은 성병균이 원인일 수도 있으므로 소변 PCR 검사를 통해 정확한 진단을 받는 것이 좋습니다. 그 외 복합성 방광염이나 재발성 방광염의 경우 요로생식계 면역이 떨어지거나 약물에 내성을 가진 균에 의해 발생하는 방광염 등 다양하기 때문에 정확한 진단이 중요하겠습니다.\n방광염은 종류에 따른 진단 방법이 다를 수 있으며 진찰을 통해 질염, 헤르페스 감염, 요도게실 등과 구별하여 방광염 치료를 받는 것이 좋겠습니다. 단순 방광염 치료는 항생제 3일 정도 처방하는 게 일반적이나 하루 1회 복용으로도 효과를 볼 수 있습니다. \n만일 항생제 내성이 있을 경우에는 각종 비뇨기적 검사를 추가 시행해야 하며 복합성 및 재발성 방광염 치료는 행동 교정, 에스트로겐 보충 및 방광 내 약물 주입, 예방적 항생제 복용, 면역력 강화 요법 등 증상 정도에 따라 여자 방광염 치료는 달라질 수 있습니다. \n또한 너무 잦은 질 세척은 유익균을 감소시킬 수 있으며 소변을 오래 참는 행동은 피하시길 바랍니다. 방광염 증상이 있다면 정확한 진단은 병원에 내원하여 검사 후 전문의 소견에 따라 방광염 치료를 받아보시길 바랍니다. \n방광염 치료 때문에 질문하셨는데 답변이 도움이 되었으면 합니다. 감사합니다.",2023.06.02.,,,,
65dd8f905bf02f695c36f2d3,30대 심장마비 증상,오늘 가슴 중앙에서 약간 왼쪽 부분에 엄청난 통증이 느껴졌는데 식은땀나고 온 몸이 특히 팔이 엄청 저리더라구요. 숨도 못쉬겠고 눈도 흐릿해지고.. 가슴통증이 나중엔 어깨랑 턱까지 올라오다가 의식을 잃은건지 잠든건지..눈떠보니까 괜찮아졌어요. 이런 증상이 30분정도 지속되었던거같아요. 보니까 심장마비 증상이랑 똑같던데 심장마비가 오지 않고도 전조증상만 나타날 수도 있는건가요?,작성일\n2023.11.22,현재 최근에 많이 불편해하셨던 증상에 대해서 해서해서 얘기해주고 계십니다 우선적으로 네이버 지식인에 답변을 참고하시기 앞서 이러한 증상이 지속적으로 나타나고 불편감을 이런다면 가까운 병원을 방문하여 의사의 대면진료를 받고 적절한 신체증이 정확한 진단과 치료를 받아보실 것을 권유를 드립니다 그리고 해당의 증상이 지속적으로 불편감을 야기하며 응급적인 증상으로 진행이 되는 경우에는 반드시 가까운 응급실을 방문하여 응급진료를 받고 정확한 진단과 치료를 받을 것을 권유를 우선적으로 강력히 드리는 바입니다  심장이 불편한 증상은 협심증이나 심근경색의 전조증상일 가능성이 높습니다 이러한 경우에는 반드시 적절한 진료와 치료가 필요할 수 있으며 가까운 순환기내과 병원을 방문하여 심전도 검사를 하고 심근효소 수치 검사를 하며 또 필요하다면 24시간 훌터 검사와 답변이 도움이 되시길 바라며 가까운 순환기병원을 방문하여 잘 질려받고 증산이 호전이 보이시기를 바라겠습니다 감사합니다,2023.11.23.,,,,
65dd8f915bf02f695c36f2d5,역류성식도염 증상 질문,역류성식도염 증상중에 목에서 소리가나는 증상도 있나요?\n숨쉴때 특히 날숨시에 목에서 그르렁그르렁 소리가납니다\n보통 처음에는 신물이 올라오거나 소화가 잘 안되다가 이후 반응으로 목이 간질간질하더니 기침이 나오다가 기침을 하다보면 목이나 가슴쪽에서 가래껴있는듯한 그르렁 그르렁 소리가납니다 막상 기침을 해보면 가래는 안나옵니다 그리고 기침을 하고나면 잠시 소리는 안나구요!\n소리가 들리면서 진동도 같이느껴집니다\n\n평소에 위장이 약해서 고생좀 하는편인데 평소와는 다르게 새로운 증상이 생겨서 고민스럽네요\n\n천식인가 의심도 해보았는데 가슴통증이나 바람새는소리 호흡곤란 등은 없어서 아닌거같습니다\n\n역류성식도염 증상일까요?,작성일\n2023.10.09,"안녕하세요\n인터엠디(InterMD) x 네이버 지식in 건강상담 의사 김무웅입니다.\nㅡㅡㅡㅡㅡㅡㅡㅡㅡㅡㅡㅡㅡㅡㅡㅡㅡㅡㅡㅡㅡㅡㅡㅡㅡㅡㅡㅡㅡㅡㅡㅡㅡㅡㅡ\n역류성식도질환(역류성식도염) 증상으로 일반적으로 숨소리가 변화하기는 어렵습니다. 그르렁 거리는 증상이 실제 로 있고 심해진다면 호흡기질환을 우선 생각해보아야겠습니다. 기침/가래, 호흡곤란/인후통 등의 유무를 확인해보고 만약 증상이 지속된다면 꼭 청진 및 엑스레이 검사를 받아보는게 좋을 것 같습니다.\n** 낮도 이제 제법 춥고, 비로 인해 오늘은 훨씬 더 쌀쌀한 초겨울 같은 날씨로 느껴져서 잠잘 때 이불을 찾게 됩니다. 이미 매미 울음은 어느새 사라지고 귀뚜라미 울음이 들리네요. 짧은 가을이 지나가고 슬슬 겨울을 준비하는 날씨에 들어섰습니다. 일교차가 요즘 매우 크니 환절기 감기 주의하시고, 적절한 수분 섭취하면서 건강관리 잘하시길 바랍니다. 8 월 31일부터 코로나가 곧 4급 전염병으로 변경되었습니다만 코로나 환자는 지속해서 많으며 독감 환자도 다시 유행 시작합니다. 곧 시작되는 독감 및 코로나 예방접종도 꼭 하시길 바라고 개인적으로는 마스크 다시 꼭 착용을 권유해 드리며 항상 손 씻기를 생활화하시면 좋겠습니다.",2023.10.10.,,,,
65dd8f925bf02f695c36f2d7,생리 전 증상,"8.8일에 마지막 관계했고 14일 뒤인 오늘 얼리임테기 사용했어요 임테기는 5분 뒤 찍은겁니다(비임신)\n지금 증상들(가슴 찌릿, 아랫배 통증)은 생리 전 증상들인가요? 7.24-30일까지 생리, 생리예정일-8.27(네이버 생리주기 상) 6.20-23 생리 (생리유도제 맞음)",작성일\n2023.08.21,"안녕하세요. 하이닥-네이버 지식iN 상담의 김종호 입니다.\n임신 초기 증상은 두통, 어지러움, 울렁거림, 가슴의 통증, 허리의 통증, 아랫배 통증, 냉의 증가. 미열,\n소량의 출혈 등이 있으며, 개인차는 있지만 대개 임신 주수 5~6주 후 (관계 2~3주 후)에 나타나게 됩니다.\n이런 증상들은 개인마다 차이가 있고 임신이 아닌 경우에도 충분히 나타날 수 있으며, \n임신 초기 증상과 생리전 증후군은 비슷한 증상이 매우 많으므로 증상만으로는 임신 여부를 판단할 수는 없습니다.\n하지만 마지막 관계 후 2주가 지난 시점에 소변 테스트에서 음성(비임신) 확인되었다면 임신 가능성은 낮으므로\n우선은 생리 예정일자에 정상적인 생리가 시작되는지 기다려보시기 바랍니다.\n생리 주기나 양상은 스트레스와 과로, 생활 습관 등으로 몸 상태에 따라 얼마든지 변할 수 있습니다만, \n비임신임을 확인했음에도 예정 생리일보다 2주 이상 지연되거나 질환에 대해 불안감이 크다면 \n가까운 산부인과로 내원하여 전문의 진찰 하에 초음파 검사를 통해 자궁과 난소의 상태를 확인할 것을 권합니다.",2023.08.22.,,,,
